<?xml version="1.0" encoding="UTF-8"?>
<!DOCTYPE pado SYSTEM "../pado1_0.dtd">

<pado id="rotc" location="us">

	<app-list>
		<app id="sys">
			<grid-list id="sys grid list" default-grid-id="rotc">
				<grid id="rotc" routing-weight="1">
					<description>The default grid id is itself, i.e., no children.</description>
				</grid>
				<description>Allowed grids for sys</description>
			</grid-list>
		</app>
		<app id="test">
			<grid-list id="test grid list" default-grid-id="rotc">
				<grid id="rotc" routing-weight="1">
					<description>Primary site</description>
				</grid>
				<description>rotc example</description>
			</grid-list>
		</app>
	</app-list>

	<path-list>
		<path name="codman_inventory" refid="persistent-partition" temporal-enabled="true" key-class-name="String"
			value-class-name="com.netcrest.pado.data.jsonlite.JsonLite">
		</path>
		<path name="mitek_inventory" refid="persistent-partition" temporal-enabled="true" key-class-name="String"
			value-class-name="com.netcrest.pado.data.jsonlite.JsonLite">
		</path>
	</path-list>

	<gemfire root-region-path="/rotc"
		init-delay="0" grid-info-update-delay="0" grid-info-update-interval="10000"
		shared-pool-name="rotc-pool-shared">
		<gemfire-parent id="go" root-region-path="/go"
			locators="localhost:20000"></gemfire-parent>
	</gemfire>

</pado>
